{
      "label": "useCaseThree",
      "type": 2,
      "components": [
        {
      "label": "toggle",
      "type": "Toggle"
      },{
      "label": "content",
      "type": "toggleSelective"
      }
      ],
      "inputs": [
        
      ],
      "outputs": [
        
      ],
      "positions": [
        {
      "label": "toggle",
      "x": 0,
      "y": 0,
      "width": 486
      },{
      "label": "content",
      "x": 0,
      "y": 0,
      "width": 486
      }
      ]
    }