{
      "label": "This is a composite component",
      "type": 2,
      "components": [
        {
      "label": "TheLabel",
      "type": "Murden"
      }
      ],
      "inputs": [
        
      ],
      "outputs": [
        
      ],
      "positions": [
        {
      "label": "TheLabel",
      "x": 164,
      "y": 204,
      "width": 50
      }
      ]
    }