{
      "label": "smallyo",
      "type": 2,
      "components": [
        {
      "label": "ayyy",
      "type": "A"
      },{
      "label": "byyyy",
      "type": "B"
      }
      ],
      "inputs": [
        
      ],
      "outputs": [
        
      ],
      "positions": [
        {
      "label": "ayyy",
      "x": 0,
      "y": 0,
      "width": 624.5
      },{
      "label": "byyyy",
      "x": 0,
      "y": 0,
      "width": 624.5
      }
      ]
    }